videoId,title,description,publishedAt
X4tvmT9060g,文字に性格出る！の 筆跡学って嘘orホント？答えは…,この動画内で紹介したおすすめ動画・ニコニコ動画は 知識のNetflix【Dラボ】で見放題！ 今なら20日間無料→https://daigovideolab.jp/ 参考文献・リサーチ協力 年5000 ...,2019-02-11T03:29:01Z
ZEF-_0m7biU,男が感じる女性の魅力１位が意外→実は体型でも性格でもなくアレが重要,この動画内で紹介したおすすめ動画・ニコニコ動画は 知識のNetflix【Dラボ】で見放題！ 今なら20日間無料→https://daigovideolab.jp/ メンタリストDaiGoの無料メンタル ...,2019-02-08T09:18:27Z
3syZEuKEiwg,糖質制限の副作用！低糖質風邪の恐怖,この動画内で紹介したおすすめ動画・ニコニコ動画は 知識のNetflix【Dラボ】で見放題！ 今なら20日間無料→https://daigovideolab.jp/ リサーチ協力:年5000論文を読む ...,2019-02-25T12:58:48Z
A2wv--7p6Hk,恋愛に理想を求めすぎて失敗する人が読むべきストーリーとは,この動画内で紹介したおすすめ動画・ニコニコ動画は 知識のNetflix【Dラボ】で見放題！ 今なら20日間無料→https://daigovideolab.jp/ メンタリストDaiGoの無料メンタル ...,2019-02-08T12:36:58Z
dRfLgL-KE5A,あそこがデカイ人は頭がいいことが判明〜僕も美女を見るとデカくなります,この動画内で紹介したおすすめ動画・ニコニコ動画は 知識のNetflix【Dラボ】で見放題！ 今なら20日間無料→https://daigovideolab.jp/ メンタリストDaiGoの無料メンタル ...,2019-02-05T15:00:51Z
7CP3Tl83KyI,見せるだけで相手の性格がわかる図形が発明される,この動画内で紹介したおすすめ動画・ニコニコ動画は 知識のNetflix【Dラボ】で見放題！ 今なら20日間無料→https://daigovideolab.jp/ 参考文献・リサーチ協力 年5000 ...,2019-02-11T14:20:02Z
NBVhf2QWvCg,いつになっても自信が持てないなら…,この動画内で紹介したおすすめ動画・ニコニコ動画は 知識のNetflix【Dラボ】で見放題！ 今なら20日間無料→https://daigovideolab.jp/ リサーチ協力:年5000論文を読む ...,2019-03-14T11:58:43Z
5T77n-jkMxw,人間関係が激変する1.3倍好かれるほめ方,この動画内で紹介したおすすめ動画・ニコニコ動画は 知識のNetflix【Dラボ】で見放題！ 今なら20日間無料→https://daigovideolab.jp/ リサーチ協力:年5000論文を読む ...,2019-03-19T05:29:18Z
fkbBjOpQ0m0,95%の人が誤解している本当にやる気が出る方法,この動画内で紹介したおすすめ動画・ニコニコ動画は 知識のNetflix【Dラボ】で見放題！ 今なら20日間無料→https://daigovideolab.jp/ リサーチ協力:年5000論文を読む ...,2019-03-08T10:28:41Z
V0a8o_AIdko,自責グセ対策〜無駄に自分を責めるのをやめて成長するには,この動画内で紹介したおすすめ動画・ニコニコ動画は 知識のNetflix【Dラボ】で見放題！ 今なら20日間無料→https://daigovideolab.jp/ この動画の続きを見たいなら ...,2019-03-30T13:37:16Z
wgNBfMY7qCs,自分のコミュニケーションに自信がなくなる本当の理由とは,この動画内で紹介したおすすめ動画・ニコニコ動画は 知識のNetflix【Dラボ】で見放題！ 今なら20日間無料→https://daigovideolab.jp/ リサーチ協力:年5000論文を読む ...,2019-03-25T06:55:09Z
IAlA1hh1Yz8,男女でここまで違う！理想のデート条件とは,この動画内で紹介したおすすめ動画・ニコニコ動画は 知識のNetflix【Dラボ】で見放題！ 今なら20日間無料→https://daigovideolab.jp/ リサーチ協力:年5000論文を読む ...,2019-03-26T13:11:29Z
Eqyt-fhsesc,夢や大きな目的なんてなくていいことが科学的に証明された件,この動画内で紹介したおすすめ動画・ニコニコ動画は 知識のNetflix【Dラボ】で見放題！ 今なら20日間無料→https://daigovideolab.jp/ リサーチ協力:年5000論文を読む ...,2019-03-19T15:00:57Z
c2X7x27qW70,嫌な体験を利用して脳を鍛える方法,この動画内で紹介したおすすめ動画・ニコニコ動画は 知識のNetflix【Dラボ】で見放題！ 今なら20日間無料→https://daigovideolab.jp/ リサーチ協力:年5000論文を読む ...,2019-03-05T12:57:46Z
7aqmeGtSOJg,表面的な人間関係しか作れない人がやりがちなコミュニケーションの間違いとは,この動画内で紹介したおすすめ動画・ニコニコ動画は 知識のNetflix【Dラボ】で見放題！ 今なら20日間無料→https://daigovideolab.jp/ リサーチ協力:年5000論文を読む ...,2019-03-07T13:58:43Z
cvtqyH8GzR4,ブレまくる人が成功する！科学的に正しいブレ方とは,この動画内で紹介したおすすめ動画・ニコニコ動画は 知識のNetflix【Dラボ】で見放題！ 今なら20日間無料→https://daigovideolab.jp/ リサーチ協力:年5000論文を読む ...,2019-03-20T05:38:51Z
uBf0QJ-b68M,人前で堂々と話せるようになる方法,この動画内で紹介したおすすめ動画・ニコニコ動画は 知識のNetflix【Dラボ】で見放題！ 今なら20日間無料→https://daigovideolab.jp/ ▶️メンタリストDaiGo の コミュ障 ...,2019-03-02T12:58:43Z
ymVLVKXYZDQ,いるものといらないモノの見分け方3選〜人生変える片付けの奥義,この動画内で紹介したおすすめ動画・ニコニコ動画は 知識のNetflix【Dラボ】で見放題！ 今なら20日間無料→https://daigovideolab.jp/ この動画の続きを見たいなら ...,2019-03-29T14:10:35Z
XqdLyNp8co4,不安脳のトリセツ〜動じない力を手に入れる方法,この動画内で紹介したおすすめ動画・ニコニコ動画は 知識のNetflix【Dラボ】で見放題！ 今なら20日間無料→https://daigovideolab.jp/ 続き。不安ストレスを前に進む力に ...,2019-03-30T05:20:14Z
S2XkRru9pcw,運を味方にする人の7つの特徴,この動画内で紹介したおすすめ動画・ニコニコ動画は 知識のNetflix【Dラボ】で見放題！ 今なら20日間無料→https://daigovideolab.jp/ リサーチ協力:年5000論文を読む ...,2019-03-02T08:58:46Z
rljp_beWPBw,他人の期待を無視すべき３つの理由,この動画内で紹介したおすすめ動画・ニコニコ動画は 知識のNetflix【Dラボ】で見放題！ 今なら20日間無料→https://daigovideolab.jp/ 続きは↓無駄なプレッシャーに ...,2019-03-21T14:33:14Z
dqFgGnLQgVs,ずっと続く集中力の作り方,この動画内で紹介したおすすめ動画・ニコニコ動画は 知識のNetflix【Dラボ】で見放題！ 今なら20日間無料→https://daigovideolab.jp/ メンタリストDaiGo の コミュ障 ...,2019-03-03T21:27:45Z
u6HSHwW1uSs,年収1000万を超えたい人にオススメのノートがこちら,この動画内で紹介したおすすめ動画・ニコニコ動画は 知識のNetflix【Dラボ】で見放題！ 今なら20日間無料→https://daigovideolab.jp/ リサーチ協力:年5000論文を読む ...,2019-03-22T05:55:52Z
0h5xbbXWYSY,お金持ちよりはるかに幸せな人が持っているもの,この動画内で紹介したおすすめ動画・ニコニコ動画は 知識のNetflix【Dラボ】で見放題！ 今なら20日間無料→https://daigovideolab.jp/ リサーチ協力:年5000論文を読む ...,2019-03-26T05:24:51Z
Ae785P7Q2j0,面倒な奴に絡まれなくなる納得の方法がこちら,この動画内で紹介したおすすめ動画・ニコニコ動画は 知識のNetflix【Dラボ】で見放題！ 今なら20日間無料→https://daigovideolab.jp/ メンタリストDaiGo の コミュ障 ...,2019-03-05T09:57:43Z
Il1mfj0_DBU,科学が明かした語学を最速で身に付ける方法,この動画内で紹介したおすすめ動画・ニコニコ動画は 知識のNetflix【Dラボ】で見放題！ 今なら20日間無料→https://daigovideolab.jp/ 分散学習帳アプリ(無料) ...,2019-03-05T02:58:43Z
rZ1Uive29Jc,超効率的！勉強時間を最小化するライトナー法とは？,この動画内で紹介したおすすめ動画・ニコニコ動画は 知識のNetflix【Dラボ】で見放題！ 今なら20日間無料→https://daigovideolab.jp/ 竹内 龍人 の 進化する勉強法: ...,2019-03-03T09:58:43Z
zbXixVbh5o4,翌日のツラさ最小限の寝不足と徹夜への科学的対策,この動画内で紹介したおすすめ動画・ニコニコ動画は 知識のNetflix【Dラボ】で見放題！ 今なら20日間無料→https://daigovideolab.jp/ リサーチ協力:年5000論文を読む ...,2019-03-04T22:57:47Z
SH2Oggu_E5A,迷ったらこちら！性格別 仕事選びの科学,この動画内で紹介したおすすめ動画・ニコニコ動画は 知識のNetflix【Dラボ】で見放題！ 今なら20日間無料→https://daigovideolab.jp/ リサーチ協力:年5000論文を読む ...,2019-03-06T12:58:43Z
g37kMGS5X7Y,"1.45倍モテるLINEの使い方〜500,000件の調査で判明",この動画内で紹介したおすすめ動画・ニコニコ動画は 知識のNetflix【Dラボ】で見放題！ 今なら20日間無料→https://daigovideolab.jp/ リサーチ協力:年5000論文を読む ...,2019-03-17T13:52:44Z
ClAmSLc5Tcw,本番に弱い自分の治し方 〜チョーキング、イップス対策の心理学,この動画内で紹介したおすすめ動画・ニコニコ動画は 知識のNetflix【Dラボ】で見放題！ 今なら20日間無料→https://daigovideolab.jp/ リサーチ協力:年5000論文を読む ...,2019-03-24T05:48:46Z
CMJssu230Tc,過去への後悔と未来への不安をなくす3つの方法,この動画内で紹介したおすすめ動画・ニコニコ動画は 知識のNetflix【Dラボ】で見放題！ 今なら20日間無料→https://daigovideolab.jp/ リサーチ協力:年5000論文を読む ...,2019-03-18T15:16:31Z
hHf0905kDv0,朝やるだけで一日の無気力と憂鬱を改善する方法,この動画内で紹介したおすすめ動画・ニコニコ動画は 知識のNetflix【Dラボ】で見放題！ 今なら20日間無料→https://daigovideolab.jp/ リサーチ協力:年5000論文を読む ...,2019-03-01T02:58:45Z
xUCi0Vg0neg,資格取るより年収が上がる科学的方法がこちら,この動画内で紹介したおすすめ動画・ニコニコ動画は 知識のNetflix【Dラボ】で見放題！ 今なら20日間無料→https://daigovideolab.jp/ リサーチ協力:年5000論文を読む ...,2019-03-18T05:24:36Z
3xhmQGb1SmE,メンタル、コミュ力、頭の良さを全部まとめてアップする行動がこちら,この動画内で紹介したおすすめ動画・ニコニコ動画は 知識のNetflix【Dラボ】で見放題！ 今なら20日間無料→https://daigovideolab.jp/ メンタリストDaiGo の コミュ障 ...,2019-03-04T08:58:19Z
5xyfm6f5Byc,IT起業に向いてる人の性格が明らかに,この動画内で紹介したおすすめ動画・ニコニコ動画は 知識のNetflix【Dラボ】で見放題！ 今なら20日間無料→https://daigovideolab.jp/ リサーチ協力:年5000論文を読む ...,2019-03-13T08:28:45Z
TFzxDbOe_f8,ネガティブが有利になる意外な状況とは,この動画内で紹介したおすすめ動画・ニコニコ動画は 知識のNetflix【Dラボ】で見放題！ 今なら20日間無料→https://daigovideolab.jp/ リサーチ協力:年5000論文を読む ...,2019-03-15T08:58:49Z
ghM9O9lTDaA,何もしてないのに朝からだるいの原因は、危険なあの疲労のサイン,この動画内で紹介したおすすめ動画・ニコニコ動画は 知識のNetflix【Dラボ】で見放題！ 今なら20日間無料→https://daigovideolab.jp/ リサーチ協力:年5000論文を読む ...,2019-03-15T02:58:45Z
z6G88bOymf4,優柔不断を1.49秒で治す方法,この動画内で紹介したおすすめ動画・ニコニコ動画は 知識のNetflix【Dラボ】で見放題！ 今なら20日間無料→https://daigovideolab.jp/ リサーチ協力:年5000論文を読む ...,2019-03-11T12:26:11Z
51bGjLRPxoM,あなたの下っ腹の脂肪が取れない理由,この動画内で紹介したおすすめ動画・ニコニコ動画は 知識のNetflix【Dラボ】で見放題！ 今なら20日間無料→https://daigovideolab.jp/ リサーチ協力:年5000論文を読む ...,2019-03-04T02:57:45Z
aEBhZTSo4uk,悶々とした人生からの脱出法4選,この動画内で紹介したおすすめ動画・ニコニコ動画は 知識のNetflix【Dラボ】で見放題！ 今なら20日間無料→https://daigovideolab.jp/ リサーチ協力:年5000論文を読む ...,2019-03-01T09:58:12Z
0dADFn4sAk0,捨てれないものあっさり捨てる心理テク,この動画内で紹介したおすすめ動画・ニコニコ動画は 知識のNetflix【Dラボ】で見放題！ 今なら20日間無料→https://daigovideolab.jp/ リサーチ協力:年5000論文を読む ...,2019-03-03T02:58:14Z
l3_TFgaehCA,いい意味でヤバイ人と悪い意味でヤバイやつのたった１つの違いとは,この動画内で紹介したおすすめ動画・ニコニコ動画は 知識のNetflix【Dラボ】で見放題！ 今なら20日間無料→https://daigovideolab.jp/ リサーチ協力:年5000論文を読む ...,2019-03-17T08:48:44Z
M_J52NFDzlk,あなたの孤独タイプ診断&amp;対策法,この動画内で紹介したおすすめ動画・ニコニコ動画は 知識のNetflix【Dラボ】で見放題！ 今なら20日間無料→https://daigovideolab.jp/ この動画の続きを見たいなら 片手 ...,2019-03-31T09:50:06Z
f7RRViWUtWA,お金と自由を同時に手に入れる技術,この動画内で紹介したおすすめ動画・ニコニコ動画は 知識のNetflix【Dラボ】で見放題！ 今なら20日間無料→https://daigovideolab.jp/ リサーチ協力:年5000論文を読む ...,2019-03-14T22:58:17Z
KkarIJt01ug,やりがい感じる仕事の3つの条件とは,この動画内で紹介したおすすめ動画・ニコニコ動画は 知識のNetflix【Dラボ】で見放題！ 今なら20日間無料→https://daigovideolab.jp/ リサーチ協力:年5000論文を読む ...,2019-03-07T11:58:45Z
z4WJoMaA9ZM,知らないうちに嫌われる人の行動4選,この動画内で紹介したおすすめ動画・ニコニコ動画は 知識のNetflix【Dラボ】で見放題！ 今なら20日間無料→https://daigovideolab.jp/ リサーチ協力:年5000論文を読む ...,2019-03-24T13:26:32Z
DmwxgSWi-hw,愛が深まる黄金律！ポジティブ：ネガティブ＝何：何,この動画内で紹介したおすすめ動画・ニコニコ動画は 知識のNetflix【Dラボ】で見放題！ 今なら20日間無料→https://daigovideolab.jp/ マッチングアプリ ” with ...,2019-03-15T23:00:00Z
g3NshVN8rEc,女子に好かれる体臭！モテ臭の作り方,この動画内で紹介したおすすめ動画・ニコニコ動画は 知識のNetflix【Dラボ】で見放題！ 今なら20日間無料→https://daigovideolab.jp/ リサーチ協力:年5000論文を読む ...,2019-03-12T10:03:22Z
6eoRlXjnosA,勉強の効果を最大化する5つのチェックリスト,この動画内で紹介したおすすめ動画・ニコニコ動画は 知識のNetflix【Dラボ】で見放題！ 今なら20日間無料→https://daigovideolab.jp/ 分散学習帳アプリ(無料) ...,2019-03-07T09:58:16Z
gEN6UWQK7lY,最も強力かつ簡単な友情の作り方〜シカゴ大研究から,この動画内で紹介したおすすめ動画・ニコニコ動画は 知識のNetflix【Dラボ】で見放題！ 今なら20日間無料→https://daigovideolab.jp/ リサーチ協力:年5000論文を読む ...,2019-03-21T05:27:50Z
Wb2lOCLy-fU,予定を入れすぎると起こる悲劇,この動画内で紹介したおすすめ動画・ニコニコ動画は 知識のNetflix【Dラボ】で見放題！ 今なら20日間無料→https://daigovideolab.jp/ リサーチ協力:年5000論文を読む ...,2019-03-08T13:58:48Z
OHGWo-bnOrc,仕事が終わらない人の３つの特徴,この動画内で紹介したおすすめ動画・ニコニコ動画は 知識のNetflix【Dラボ】で見放題！ 今なら20日間無料→https://daigovideolab.jp/ リサーチ協力:年5000論文を読む ...,2019-03-11T11:45:10Z
d_6q3WnDw2c,あなたを生かすストレス、殺すストレスの見分け方,この動画内で紹介したおすすめ動画・ニコニコ動画は 知識のNetflix【Dラボ】で見放題！ 今なら20日間無料→https://daigovideolab.jp/ リサーチ協力:年5000論文を読む ...,2019-03-10T12:27:02Z
5hX6uHaq8SM,チラ読みでわかる！自分に合った本・テキストの選び方,この動画内で紹介したおすすめ動画・ニコニコ動画は 知識のNetflix【Dラボ】で見放題！ 今なら20日間無料→https://daigovideolab.jp/ この動画の続きを見たいなら 科学 ...,2019-03-31T05:35:03Z
AJKBQHUPySU,LINEでわかる！終わるカップルと続くカップルの違いとは,この動画内で紹介したおすすめ動画・ニコニコ動画は 知識のNetflix【Dラボ】で見放題！ 今なら20日間無料→https://daigovideolab.jp/ リサーチ協力:年5000論文を読む ...,2019-03-12T12:59:48Z
M3auvbpaKP4,手書きのノートが向いてる人、デジタルノートが向いてる人の違いとは,この動画内で紹介したおすすめ動画・ニコニコ動画は 知識のNetflix【Dラボ】で見放題！ 今なら20日間無料→https://daigovideolab.jp/ リサーチ協力:年5000論文を読む ...,2019-03-19T09:15:12Z
F8hjWrkHaMo,企業の陰謀！朝食を抜くと太る説,この動画内で紹介したおすすめ動画・ニコニコ動画は 知識のNetflix【Dラボ】で見放題！ 今なら20日間無料→https://daigovideolab.jp/ リサーチ協力:年5000論文を読む ...,2019-03-09T11:53:30Z
T5Dso7B-MTI,飽きっぽい人の意外すぎる才能とは,この動画内で紹介したおすすめ動画・ニコニコ動画は 知識のNetflix【Dラボ】で見放題！ 今なら20日間無料→https://daigovideolab.jp/ リサーチ協力:年5000論文を読む ...,2019-03-04T12:58:19Z
Oo2RV9TvATI,幸せな人の83%が持っているモノがこちら,この動画内で紹介したおすすめ動画・ニコニコ動画は 知識のNetflix【Dラボ】で見放題！ 今なら20日間無料→https://daigovideolab.jp/ リサーチ協力:年5000論文を読む ...,2019-03-08T12:22:32Z
-yQbfQYEvAQ,最新の性研究〜夜が激しめな人の意外な特徴,この動画内で紹介したおすすめ動画・ニコニコ動画は 知識のNetflix【Dラボ】で見放題！ 今なら20日間無料→https://daigovideolab.jp/ この動画の続き(YouTubeだ ...,2019-03-31T14:53:08Z
FatUC3RMQZc,実は非効率なやってはいけない勉強法5選,この動画内で紹介したおすすめ動画・ニコニコ動画は 知識のNetflix【Dラボ】で見放題！ 今なら20日間無料→https://daigovideolab.jp/ メンタリストDaiGo の 最短の時間 ...,2019-03-06T08:58:49Z
3ldR6ugAZuI,浮気男の取説〜稼ぐ男に浮気させないためには,この動画内で紹介したおすすめ動画・ニコニコ動画は 知識のNetflix【Dラボ】で見放題！ 今なら20日間無料→https://daigovideolab.jp/ リサーチ協力:年5000論文を読む ...,2019-03-10T13:28:40Z
hCVkplSw9ng,頑固なバカを相手にしなくてはいけなくなった時の対処法,この動画内で紹介したおすすめ動画・ニコニコ動画は 知識のNetflix【Dラボ】で見放題！ 今なら20日間無料→https://daigovideolab.jp/ この動画の続きを見たいなら 知識 ...,2019-03-27T13:48:50Z
chaTuJ07o80,浮気する人が高確率で持ってるモノがこちら,この動画内で紹介したおすすめ動画・ニコニコ動画は 知識のNetflix【Dラボ】で見放題！ 今なら20日間無料→https://daigovideolab.jp/ この動画の続きを見たいなら ...,2019-03-28T13:27:47Z
ijxw0B7NSAM,足元を見るだけ！メンタルをこじらせてる人の見抜き方,この動画内で紹介したおすすめ動画・ニコニコ動画は 知識のNetflix【Dラボ】で見放題！ 今なら20日間無料→https://daigovideolab.jp/ リサーチ協力:年5000論文を読む ...,2019-03-13T12:15:53Z
AxUtG66xTjA,年に4冊以上読んだらアウトな本とは,この動画内で紹介したおすすめ動画・ニコニコ動画は 知識のNetflix【Dラボ】で見放題！ 今なら20日間無料→https://daigovideolab.jp/ リサーチ協力:年5000論文を読む ...,2019-03-21T10:33:47Z
1IjgoDOa7jw,いい話と悪い話、どっちを先に伝えるか問題に答えが,この動画内で紹介したおすすめ動画・ニコニコ動画は 知識のNetflix【Dラボ】で見放題！ 今なら20日間無料→https://daigovideolab.jp/ リサーチ協力:年5000論文を読む ...,2019-03-02T02:58:48Z
rDp1ic_3HIQ,記憶力が1.5倍に上がる筋トレが意外と簡単な件,この動画内で紹介したおすすめ動画・ニコニコ動画は 知識のNetflix【Dラボ】で見放題！ 今なら20日間無料→https://daigovideolab.jp/ この動画の続きを見たいなら ...,2019-03-29T05:27:40Z
sx8PcVZJDF8,超名門デューク大学が明かしたモテる人の自己紹介の特徴,この動画内で紹介したおすすめ動画・ニコニコ動画は 知識のNetflix【Dラボ】で見放題！ 今なら20日間無料→https://daigovideolab.jp/ リサーチ協力:年5000論文を読む ...,2019-03-23T05:20:45Z
rAsv3GfnspQ,最近疲れやすい…を解消するホルミーシス入門,この動画内で紹介したおすすめ動画・ニコニコ動画は 知識のNetflix【Dラボ】で見放題！ 今なら20日間無料→https://daigovideolab.jp/ リサーチ協力:年5000論文を読む ...,2019-03-09T12:52:58Z
Lp5PRYg3dHM,脳の処理速度を加速する道具がこちら,この動画内で紹介したおすすめ動画・ニコニコ動画は 知識のNetflix【Dラボ】で見放題！ 今なら20日間無料→https://daigovideolab.jp/ リサーチ協力:年5000論文を読む ...,2019-03-09T02:58:12Z
njkzPin72is,科学的に最強のおやつがこちら,この動画内で紹介したおすすめ動画・ニコニコ動画は 知識のNetflix【Dラボ】で見放題！ 今なら20日間無料→https://daigovideolab.jp/ リサーチ協力:年5000論文を読む ...,2019-03-17T05:26:09Z
zoE3UrRNCF0,ちょっと読むだけでも頭が良くなる本がこちら,この動画内で紹介したおすすめ動画・ニコニコ動画は 知識のNetflix【Dラボ】で見放題！ 今なら20日間無料→https://daigovideolab.jp/ リサーチ協力:年5000論文を読む ...,2019-03-27T05:26:58Z
895LZ05rD0k,机に置くだけで肌荒れが改善するものがこちら〜前半はイライラ対策,この動画内で紹介したおすすめ動画・ニコニコ動画は 知識のNetflix【Dラボ】で見放題！ 今なら20日間無料→https://daigovideolab.jp/ リサーチ協力:年5000論文を読む ...,2019-03-16T09:10:58Z
MhkQmeimzxc,コンビニで買えるメンタル良くなる商品がこちら,この動画内で紹介したおすすめ動画・ニコニコ動画は 知識のNetflix【Dラボ】で見放題！ 今なら20日間無料→https://daigovideolab.jp/ リサーチ協力:年5000論文を読む ...,2019-03-12T03:23:32Z
W5mhQ6LL5Y4,実は38個もある童貞卒業遺伝子の真実,この動画内で紹介したおすすめ動画・ニコニコ動画は 知識のNetflix【Dラボ】で見放題！ 今なら20日間無料→https://daigovideolab.jp/ リサーチ協力:年5000論文を読む ...,2019-03-01T12:58:11Z
mkmjOHVwzkk,メンタル病みやすい人の子供時代の特徴がこちら,この動画内で紹介したおすすめ動画・ニコニコ動画は 知識のNetflix【Dラボ】で見放題！ 今なら20日間無料→https://daigovideolab.jp/ リサーチ協力:年5000論文を読む ...,2019-03-03T12:58:16Z
L9JLjDDh2D8,運動ナシ！1日2.7回で体重が10%減る方法,この動画内で紹介したおすすめ動画・ニコニコ動画は 知識のNetflix【Dラボ】で見放題！ 今なら20日間無料→https://daigovideolab.jp/ この動画の続きを見たいなら 1日4 ...,2019-03-28T05:58:53Z
9hJzHTxWYKs,頭がいいフリして、実は中身のないやつの特徴がこちら,この動画内で紹介したおすすめ動画・ニコニコ動画は 知識のNetflix【Dラボ】で見放題！ 今なら20日間無料→https://daigovideolab.jp/ リサーチ協力:年5000論文を読む ...,2019-03-15T14:10:47Z
Ff1-Gxi3WyU,昼休みにすると、収入とメンタルがガタ落ちする行動とは,この動画内で紹介したおすすめ動画・ニコニコ動画は 知識のNetflix【Dラボ】で見放題！ 今なら20日間無料→https://daigovideolab.jp/ リサーチ協力:年5000論文を読む ...,2019-03-13T03:24:28Z
p0eNOz3AhDc,教科書を何度も読む→むしろ成績落ちる説,この動画内で紹介したおすすめ動画・ニコニコ動画は 知識のNetflix【Dラボ】で見放題！ 今なら20日間無料→https://daigovideolab.jp/ リサーチ協力:年5000論文を読む ...,2019-03-23T15:46:32Z
