videoId,title,description,publishedAt
2AEYlgqjOmc,コミュ力を高める「対話不安」克服法〜自信満々に会話する他人の秘密,この動画内で紹介したおすすめ動画・ニコニコ動画は 知識のNetflix【Dラボ】で見放題！ 今なら20日間無料→https://daigovideolab.jp/ メンタリストDaiGoと弟制作の無料 ...,2019-01-05T13:17:24Z
8nacUYJhPQ8,先延ばし癖が自然消滅するカールトンメソッド,この動画内で紹介したおすすめ動画・ニコニコ動画は 知識のNetflix【Dラボ】で見放題！ 今なら20日間無料→https://daigovideolab.jp/ メンタリストDaiGoの無料メンタル ...,2019-01-15T09:19:30Z
18v-cjwHV4o,不安が止まらない！の負のスパイラル脱出法,この動画内で紹介したおすすめ動画・ニコニコ動画は 知識のNetflix【Dラボ】で見放題！ 今なら20日間無料→https://daigovideolab.jp/ メンタリストDaiGoの無料メンタル ...,2019-01-17T14:56:09Z
oEfqmBvYQyU,いい人のふりしてあなたを攻撃してくる人への対処法,この動画内で紹介したおすすめ動画・ニコニコ動画は 知識のNetflix【Dラボ】で見放題！ 今なら20日間無料→https://daigovideolab.jp/ オススメ本 ジョージ サイモン の ...,2019-01-26T13:29:30Z
WHBT4v1Pmv8,倍速上達法～2倍速で何かを身につけるには,この動画内で紹介したおすすめ動画・ニコニコ動画は 知識のNetflix【Dラボ】で見放題！ 今なら20日間無料→https://daigovideolab.jp/ メンタリストDaiGoと弟制作の無料 ...,2019-01-12T13:23:19Z
l0W55oX6DvY,ちょっとした言い換えでお金が貯まる思考変換法,この動画内で紹介したおすすめ動画・ニコニコ動画は 知識のNetflix【Dラボ】で見放題！ 今なら20日間無料→https://daigovideolab.jp/ メンタリストDaiGoと弟制作の無料 ...,2019-01-09T08:47:01Z
ebrJaFz-ono,頑固な相手の意見を変える方法,この動画内で紹介したおすすめ動画・ニコニコ動画は 知識のNetflix【Dラボ】で見放題！ 今なら20日間無料→https://daigovideolab.jp/ メンタリストDaiGoの無料メンタル ...,2019-01-16T09:24:24Z
XbZ5PzGGWaQ,科学が認めた6つの会話力トレーニング,この動画内で紹介したおすすめ動画・ニコニコ動画は 知識のNetflix【Dラボ】で見放題！ 今なら20日間無料→https://daigovideolab.jp/ 参考 ...,2019-01-27T08:20:42Z
74oPN0ViqKk,欠点を強みに変える方法〜すごい人は何かが圧倒的に欠けている,この動画内で紹介したおすすめ動画・ニコニコ動画は 知識のNetflix【Dラボ】で見放題！ 今なら20日間無料→https://daigovideolab.jp/ オススメ本&参考 ロバート ...,2019-01-20T08:55:11Z
X5B-b1Levp8,なぜかいつも上から目線の人の残念すぎる正体,この動画内で紹介したおすすめ動画・ニコニコ動画は 知識のNetflix【Dラボ】で見放題！ 今なら20日間無料→https://daigovideolab.jp/ メンタリストDaiGoの無料メンタル ...,2019-01-15T13:26:09Z
l5tnpc0GseI,信用されやすい人の特徴が判明,この動画内で紹介したおすすめ動画・ニコニコ動画は 知識のNetflix【Dラボ】で見放題！ 今なら20日間無料→https://daigovideolab.jp/ 参考 ...,2019-01-21T04:03:44Z
Gmwnuol__HY,人に会わずにコミュ力を高める方法,この動画内で紹介したおすすめ動画・ニコニコ動画は 知識のNetflix【Dラボ】で見放題！ 今なら20日間無料→https://daigovideolab.jp/ 参考 ...,2019-01-20T05:50:06Z
afolInUlYOM,やる気とやりがいの科学的高め方,この動画内で紹介したおすすめ動画・ニコニコ動画は 知識のNetflix【Dラボ】で見放題！ 今なら20日間無料→https://daigovideolab.jp/ 参考 ...,2019-01-24T09:24:07Z
glkNgx_TbIQ,相手の声だけで本心を暴くスキルがこちら,この動画内で紹介したおすすめ動画・ニコニコ動画は 知識のNetflix【Dラボ】で見放題！ 今なら20日間無料→https://daigovideolab.jp/ メンタリストDaiGoの無料メンタル ...,2019-01-14T09:19:40Z
YkFhkRafWYw,布団でダラダラした日に起こる10の悲劇,この動画内で紹介したおすすめ動画・ニコニコ動画は 知識のNetflix【Dラボ】で見放題！ 今なら20日間無料→https://daigovideolab.jp/ メンタリストDaiGoの無料メンタル ...,2019-01-19T04:50:04Z
reoY4iqMzoA,午後の仕事が超ラクになる昼休みに取るべき行動,この動画内で紹介したおすすめ動画・ニコニコ動画は 知識のNetflix【Dラボ】で見放題！ 今なら20日間無料→https://daigovideolab.jp/ いつ何をすれば一番ラクに効率的 ...,2019-01-15T03:45:23Z
5hQe5Mekrqk,97%の確率で食欲を抑える方法,この動画内で紹介したおすすめ動画・ニコニコ動画は 知識のNetflix【Dラボ】で見放題！ 今なら20日間無料→https://daigovideolab.jp/ 参考 ...,2019-01-27T06:42:23Z
sLPiR9IPib4,三日坊主を防ぐ「曖昧目標」のススメ,この動画内で紹介したおすすめ動画・ニコニコ動画は 知識のNetflix【Dラボ】で見放題！ 今なら20日間無料→https://daigovideolab.jp/ 続き ...,2019-01-01T13:23:10Z
NlUHOmnv6sg,目標ない方が人生うまくいく理由,この動画内で紹介したおすすめ動画・ニコニコ動画は 知識のNetflix【Dラボ】で見放題！ 今なら20日間無料→https://daigovideolab.jp/ メンタリストDaiGoと弟制作の無料 ...,2019-01-06T13:21:22Z
AlkIFhSKUzM,子供時代のトラウマが脳に与える影響とその対策,この動画内で紹介したおすすめ動画・ニコニコ動画は 知識のNetflix【Dラボ】で見放題！ 今なら20日間無料→https://daigovideolab.jp/ 参考 ...,2019-01-20T13:33:34Z
AOsVyxVyEew,心理学的に正しい対人トラブル解決法,この動画内で紹介したおすすめ動画・ニコニコ動画は 知識のNetflix【Dラボ】で見放題！ 今なら20日間無料→https://daigovideolab.jp/ 参考 ...,2019-01-19T14:34:25Z
c6oN7CQpUpY,不安を3秒で沈めることができるメンタルクリア法とは,この動画内で紹介したおすすめ動画・ニコニコ動画は 知識のNetflix【Dラボ】で見放題！ 今なら20日間無料→https://daigovideolab.jp/ メンタリストDaiGoの無料メンタル ...,2019-01-14T13:52:27Z
DPksM-JzI0U,貯金の３つの新技術〜無駄遣いをなくしてひと財産を作る方法,この動画内で紹介したおすすめ動画・ニコニコ動画は 知識のNetflix【Dラボ】で見放題！ 今なら20日間無料→https://daigovideolab.jp/ ...,2019-01-03T13:32:56Z
QG-rJxNmN30,幸せなはずなのに不幸を感じる3つの理由と脱出法,この動画内で紹介したおすすめ動画・ニコニコ動画は 知識のNetflix【Dラボ】で見放題！ 今なら20日間無料→https://daigovideolab.jp/ 参考 ...,2019-01-21T13:53:43Z
5angKouixTE,ハーバード大の30分で33%も不安が軽減する方法,この動画内で紹介したおすすめ動画・ニコニコ動画は 知識のNetflix【Dラボ】で見放題！ 今なら20日間無料→https://daigovideolab.jp/ メンタリストDaiGoと弟制作の無料 ...,2019-01-09T14:32:50Z
4SFKA4PSgCc,自分を偽ると病みまくるキャラ疲れの原因と対策,この動画内で紹介したおすすめ動画・ニコニコ動画は 知識のNetflix【Dラボ】で見放題！ 今なら20日間無料→https://daigovideolab.jp/ 参考 ...,2019-01-30T13:26:27Z
cSJNANrBR00,コンプレックス解消の心理学〜フツーの見た目で美男美女を打倒する戦略,この動画内で紹介したおすすめ動画・ニコニコ動画は 知識のNetflix【Dラボ】で見放題！ 今なら20日間無料→https://daigovideolab.jp/ 無料メンタル系アプリを作りました ...,2019-01-25T13:50:21Z
sKUZnCruKm4,ニセ健康食〜トクホとかの闇,この動画内で紹介したおすすめ動画・ニコニコ動画は 知識のNetflix【Dラボ】で見放題！ 今なら20日間無料→https://daigovideolab.jp/ メンタリストDaiGoの無料メンタル ...,2019-01-16T05:26:47Z
X3bqLK5SgxE,モテる上に給料上がる5つのしゃべり方のポイントとは？,この動画内で紹介したおすすめ動画・ニコニコ動画は 知識のNetflix【Dラボ】で見放題！ 今なら20日間無料→https://daigovideolab.jp/ メンタリストDaiGoと弟制作の無料 ...,2019-01-07T13:29:13Z
P6ZXwiJeVV0,男女関係が手軽に良くなる行動がこちら,この動画内で紹介したおすすめ動画・ニコニコ動画は 知識のNetflix【Dラボ】で見放題！ 今なら20日間無料→https://daigovideolab.jp/ 参考 Sarah Gomillion et al.,2019-01-31T14:22:31Z
QyZVQa9TwI0,自分を操る超記録術〜計画より記録が目標達成率を上げる！,この動画内で紹介したおすすめ動画・ニコニコ動画は 知識のNetflix【Dラボ】で見放題！ 今なら20日間無料→https://daigovideolab.jp/ メンタリストDaiGoの無料メンタル ...,2019-01-18T14:07:54Z
htiYlcgh0VU,倒れそうな計画を再設定するための10のチェックリスト,この動画内で紹介したおすすめ動画・ニコニコ動画は 知識のNetflix【Dラボ】で見放題！ 今なら20日間無料→https://daigovideolab.jp/ 参考とオススメ本 リチャード ...,2019-01-27T05:23:58Z
BfpEKz_Q7NA,結婚に向かない人の性格が判明,この動画内で紹介したおすすめ動画・ニコニコ動画は 知識のNetflix【Dラボ】で見放題！ 今なら20日間無料→https://daigovideolab.jp/ メンタリストDaiGoの無料メンタル ...,2019-01-18T08:45:04Z
QBlvnF8H_sI,DVしやすい男の5つの特徴,この動画内で紹介したおすすめ動画・ニコニコ動画は 知識のNetflix【Dラボ】で見放題！ 今なら20日間無料→https://daigovideolab.jp/ メンタリストDaiGoの無料メンタル ...,2019-01-16T13:09:18Z
Z0UXIFqOfuA,人工甘味料の本当の闇が明らかに,この動画内で紹介したおすすめ動画・ニコニコ動画は 知識のNetflix【Dラボ】で見放題！ 今なら20日間無料→https://daigovideolab.jp/ メンタリストDaiGoの無料メンタル ...,2019-01-26T05:30:36Z
bISpRpCCE1k,コミュ力なくても効果絶大なLINEの送り方が判明,"この動画内で紹介したおすすめ動画・ニコニコ動画は 知識のNetflix【Dラボ】で見放題！ 今なら20日間無料→https://daigovideolab.jp/ 参考 Amit Kumar, Nicholas ...",2019-01-29T13:20:06Z
eHmN8eVXrLc,あなたの性格のうち親の影響は何%？に答えが出た件,この動画内で紹介したおすすめ動画・ニコニコ動画は 知識のNetflix【Dラボ】で見放題！ 今なら20日間無料→https://daigovideolab.jp/ 参考 ...,2019-01-21T08:41:34Z
jHsO2sePIjI,通勤通学時間が長いと起きる5つのヤバいこと,この動画内で紹介したおすすめ動画・ニコニコ動画は 知識のNetflix【Dラボ】で見放題！ 今なら20日間無料→https://daigovideolab.jp/ 参考 ...,2019-01-28T09:16:51Z
n3TAFLGez_M,無視すべき親の意見の特徴はこちら,この動画内で紹介したおすすめ動画・ニコニコ動画は 知識のNetflix【Dラボ】で見放題！ 今なら20日間無料→https://daigovideolab.jp/ メンタリストDaiGoの無料メンタル ...,2019-01-17T08:15:55Z
YFbplAMMk6Q,散らかった机のメリットが発見される,この動画内で紹介したおすすめ動画・ニコニコ動画は 知識のNetflix【Dラボ】で見放題！ 今なら20日間無料→https://daigovideolab.jp/ メンタリストDaiGoの無料メンタル ...,2019-01-23T06:14:57Z
WnLtgIALGdg,高級品ほぼ意味ナシ！本当に効くスキンケアとは,この動画内で紹介したおすすめ動画・ニコニコ動画は 知識のNetflix【Dラボ】で見放題！ 今なら20日間無料→https://daigovideolab.jp/ 科学的にオススメなスキンケア ...,2019-01-24T05:25:04Z
5pQXYqBcqZ8,衝撃！ジムに行くほど太る人の特徴,この動画内で紹介したおすすめ動画・ニコニコ動画は 知識のNetflix【Dラボ】で見放題！ 今なら20日間無料→https://daigovideolab.jp/ 参考 ...,2019-01-30T05:21:22Z
luc0Z8kIkDk,つらい時こそ笑え、の結果起こるやばいこと,この動画内で紹介したおすすめ動画・ニコニコ動画は 知識のNetflix【Dラボ】で見放題！ 今なら20日間無料→https://daigovideolab.jp/ 参考 ...,2019-01-22T03:52:57Z
RtB1FV6pv1w,ストレスでドカ食いしやすい人の特徴,この動画内で紹介したおすすめ動画・ニコニコ動画は 知識のNetflix【Dラボ】で見放題！ 今なら20日間無料→https://daigovideolab.jp/ 参考 ...,2019-01-31T10:53:46Z
EV8dkzw7YGU,権力者がバカなこと言い始める理由がこちら,この動画内で紹介したおすすめ動画・ニコニコ動画は 知識のNetflix【Dラボ】で見放題！ 今なら20日間無料→https://daigovideolab.jp/ メンタリストDaiGoの無料メンタル ...,2019-01-12T09:36:40Z
Pv3F9-Rp94E,嵐さんへの無責任発言でわかるメディア関係者のヤバさを解説,この動画内で紹介したおすすめ動画・ニコニコ動画は 知識のNetflix【Dラボ】で見放題！ 今なら20日間無料→https://daigovideolab.jp/ 参考 ケヴィン・ダットン の ...,2019-01-28T04:27:39Z
2H-nXxDxn2M,起業、投資…リスクを取ることが向いてる人とそうでない人の違い,この動画内で紹介したおすすめ動画・ニコニコ動画は 知識のNetflix【Dラボ】で見放題！ 今なら20日間無料→https://daigovideolab.jp/ 参考 ...,2019-01-23T09:31:45Z
CE9qpJzS6RY,15分で記憶力を上げる方法,この動画内で紹介したおすすめ動画・ニコニコ動画は 知識のNetflix【Dラボ】で見放題！ 今なら20日間無料→https://daigovideolab.jp/ 参考 ...,2019-01-28T03:21:11Z
zT0b7SeLSmQ,アレについて考えるだけでお金がなくなっていくことが判明,この動画内で紹介したおすすめ動画・ニコニコ動画は 知識のNetflix【Dラボ】で見放題！ 今なら20日間無料→https://daigovideolab.jp/ メンタリストDaiGoと弟制作の無料 ...,2019-01-08T13:20:04Z
Li_n4CyZQLI,某アイドルの謝罪に学ぶ、ダメな謝罪とイイ謝罪の違い,この動画内で紹介したおすすめ動画・ニコニコ動画は 知識のNetflix【Dラボ】で見放題！ 今なら20日間無料→https://daigovideolab.jp/ メンタリストDaiGoの無料メンタル ...,2019-01-13T13:23:09Z
gZkrn3HnLq4,ブレインストーミングが無駄であることが証明される,"この動画内で紹介したおすすめ動画・ニコニコ動画は 知識のNetflix【Dラボ】で見放題！ 今なら20日間無料→https://daigovideolab.jp/ 参考 Furnham, ...",2019-01-29T08:44:29Z
XBDea9iQK-s,正月休みムダにする人しない人,この動画内で紹介したおすすめ動画・ニコニコ動画は 知識のNetflix【Dラボ】で見放題！ 今なら20日間無料→https://daigovideolab.jp/ メンタリストDaiGoと弟制作の無料 ...,2019-01-02T13:15:43Z
SIG5C7x2rbY,満足してるカップルほど浮気しやすい理由,この動画内で紹介したおすすめ動画・ニコニコ動画は 知識のNetflix【Dラボ】で見放題！ 今なら20日間無料→https://daigovideolab.jp/ メンタリストDaiGoの無料メンタル ...,2019-01-13T13:54:10Z
VcOFrN-oiBM,結婚のメリットが得られる人の特徴,この動画内で紹介したおすすめ動画・ニコニコ動画は 知識のNetflix【Dラボ】で見放題！ 今なら20日間無料→https://daigovideolab.jp/ メンタリストDaiGoの無料メンタル ...,2019-01-23T14:04:25Z
l8abcIGBQ1c,結婚に向く顔、ワンナイトに向く顔の違いが明らかに,この動画内で紹介したおすすめ動画・ニコニコ動画は 知識のNetflix【Dラボ】で見放題！ 今なら20日間無料→https://daigovideolab.jp/ 参考 ...,2019-01-28T15:41:45Z
EyEvlu_MfHU,お金で幸せを買える人、買えない人の３つの違いとは,この動画内で紹介したおすすめ動画・ニコニコ動画は 知識のNetflix【Dラボ】で見放題！ 今なら20日間無料→https://daigovideolab.jp/ 参考 ...,2019-01-26T08:53:27Z
l2KgrMFt8Yg,金と地位と名誉を手に入れる人の３つの特徴,この動画内で紹介したおすすめ動画・ニコニコ動画は 知識のNetflix【Dラボ】で見放題！ 今なら20日間無料→https://daigovideolab.jp/ メンタリストDaiGoの無料メンタル ...,2019-01-19T13:00:49Z
sY72uG_piKQ,脳を狂わせる3つのヤバイ食品,この動画内で紹介したおすすめ動画・ニコニコ動画は 知識のNetflix【Dラボ】で見放題！ 今なら20日間無料→https://daigovideolab.jp/ メンタリストDaiGoの無料メンタル ...,2019-01-30T08:21:59Z
FeXFkjroyxY,働いたら負け、が科学的に証明されたかもな件,この動画内で紹介したおすすめ動画・ニコニコ動画は 知識のNetflix【Dラボ】で見放題！ 今なら20日間無料→https://daigovideolab.jp/ 参考 A Mind For Numbers: How ...,2019-01-25T08:41:05Z
YmjBzPeb78I,知らないうちにコミュ力が33%低下するやばい行動＋おすすめ破格ワイン,この動画内で紹介したおすすめ動画・ニコニコ動画は 知識のNetflix【Dラボ】で見放題！ 今なら20日間無料→https://daigovideolab.jp/ メンタリストDaiGoと弟制作の無料 ...,2019-01-10T14:26:31Z
UjVE5a-6RE8,家庭トラブルを減らすために今すぐやるべきこととは,この動画内で紹介したおすすめ動画・ニコニコ動画は 知識のNetflix【Dラボ】で見放題！ 今なら20日間無料→https://daigovideolab.jp/ 参考 ...,2019-01-24T14:21:14Z
9gixBMhgQsA,頭悪くなるスマホの使用時間が判明📱,この動画内で紹介したおすすめ動画・ニコニコ動画は 知識のNetflix【Dラボ】で見放題！ 今なら20日間無料→https://daigovideolab.jp/ メンタリストDaiGoと弟制作の無料 ...,2019-01-11T13:18:54Z
Oiz1ydCjxNs,人間関係の価値をお金に換算すると…衝撃の金額に,この動画内で紹介したおすすめ動画・ニコニコ動画は 知識のNetflix【Dラボ】で見放題！ 今なら20日間無料→https://daigovideolab.jp/ メンタリストDaiGoの無料メンタル ...,2019-01-22T09:31:13Z
Ed-T7lKVYBA,友達むしろ減らして幸せになる方法,この動画内で紹介したおすすめ動画・ニコニコ動画は 知識のNetflix【Dラボ】で見放題！ 今なら20日間無料→https://daigovideolab.jp/ メンタリストDaiGoの無料メンタル ...,2019-01-17T12:25:49Z
LPVhHZYyQ5Q,握手だけで相手の将来性を見抜く方法,この動画内で紹介したおすすめ動画・ニコニコ動画は 知識のNetflix【Dラボ】で見放題！ 今なら20日間無料→https://daigovideolab.jp/ メンタリストDaiGoの無料メンタル ...,2019-01-13T06:23:31Z
JuogOS4MIGQ,謝罪系ニュースが増えた本当の理由,この動画内で紹介したおすすめ動画・ニコニコ動画は 知識のNetflix【Dラボ】で見放題！ 今なら20日間無料→https://daigovideolab.jp/ メンタリストDaiGoの無料メンタル ...,2019-01-11T09:16:00Z
ZitjUC7pIRM,子供に３６％も多く野菜を食べさせる方法,この動画内で紹介したおすすめ動画・ニコニコ動画は 知識のNetflix【Dラボ】で見放題！ 今なら20日間無料→https://daigovideolab.jp/ メンタリストDaiGoと弟制作の無料 ...,2019-01-10T08:43:20Z
rmenGQOxIRs,自己中の上位互換！ 隠れナルシストを見抜くには,この動画内で紹介したおすすめ動画・ニコニコ動画は 知識のNetflix【Dラボ】で見放題！ 今なら20日間無料→https://daigovideolab.jp/ 参考 ...,2019-01-27T13:40:06Z
WVx0NwgEGII,パンケーキ食べたいを心理学的に救いたい,この動画内で紹介したおすすめ動画・ニコニコ動画は 知識のNetflix【Dラボ】で見放題！ 今なら20日間無料→https://daigovideolab.jp/ メンタリストDaiGoと弟制作の無料 ...,2019-01-07T09:14:07Z
QGTCti6VDKI,筋トレの効果を上げる音楽が発見される,この動画内で紹介したおすすめ動画・ニコニコ動画は 知識のNetflix【Dラボ】で見放題！ 今なら20日間無料→https://daigovideolab.jp/ 参考 ...,2019-01-25T03:42:25Z
jxXUZ5ZCK8M,鬱がコミュ障を加速する理由と対策,この動画内で紹介したおすすめ動画・ニコニコ動画は 知識のNetflix【Dラボ】で見放題！ 今なら20日間無料→https://daigovideolab.jp/ メンタリストDaiGoの無料メンタル ...,2019-01-22T13:35:33Z
PBxqagPvCMA,達成率3.5倍！新しい目標はいつ始めればいいか判明,この動画内で紹介したおすすめ動画・ニコニコ動画は 知識のNetflix【Dラボ】で見放題！ 今なら20日間無料→https://daigovideolab.jp/ メンタリストDaiGoの無料メンタル ...,2019-01-14T05:16:21Z
3cQzVdkXSso,一流シェフと貴族のしゃぶしゃぶしてみた※酔ってます,この動画内で紹介したおすすめ動画・ニコニコ動画は 知識のNetflix【Dラボ】で見放題！ 今なら20日間無料→https://daigovideolab.jp/ メンタリストDaiGoの無料メンタル ...,2019-01-31T16:29:02Z
MvX0bdDjz3s,元彼・元カノと復縁するための大ヒント,この動画内で紹介したおすすめ動画・ニコニコ動画は 知識のNetflix【Dラボ】で見放題！ 今なら20日間無料→https://daigovideolab.jp/ マッチングアプリ ” with ...,2019-02-28T23:30:01Z
fc9hDHM38xY,夢を現実化する4つの心理テク,この動画内で紹介したおすすめ動画・ニコニコ動画は 知識のNetflix【Dラボ】で見放題！ 今なら20日間無料→https://daigovideolab.jp/ リサーチ協力:年5000論文を読む ...,2019-02-23T09:58:17Z
5rt-S1iurMA,損しないギブアンドテイクの方法が解明される,この動画内で紹介したおすすめ動画・ニコニコ動画は 知識のNetflix【Dラボ】で見放題！ 今なら20日間無料→https://daigovideolab.jp/ リサーチ協力:年5000論文を読む ...,2019-02-16T08:48:14Z
zxdIJ63dhdQ,悲劇的逆境から立ち直るための7つの習慣,この動画内で紹介したおすすめ動画・ニコニコ動画は 知識のNetflix【Dラボ】で見放題！ 今なら20日間無料→https://daigovideolab.jp/ 続きは… 逆境力の高い人の10の ...,2019-02-23T11:57:48Z
nKXlqt_kMXI,30分で記憶力を2倍にするLOCIメソッドとは,この動画内で紹介したおすすめ動画・ニコニコ動画は 知識のNetflix【Dラボ】で見放題！ 今なら20日間無料→https://daigovideolab.jp/ リサーチ協力:年5000論文を読む ...,2019-02-27T08:58:15Z
1uGn2J0ApQ8,幸運の波に乗れる人、乗れない人の違い,この動画内で紹介したおすすめ動画・ニコニコ動画は 知識のNetflix【Dラボ】で見放題！ 今なら20日間無料→https://daigovideolab.jp/ リサーチ協力:年5000論文を読む ...,2019-02-17T08:46:33Z
1FDCq5-z0Uk,友達がいるのに孤独を感じる理由が明らかに,この動画内で紹介したおすすめ動画・ニコニコ動画は 知識のNetflix【Dラボ】で見放題！ 今なら20日間無料→https://daigovideolab.jp/ 参考文献・リサーチ協力 年5000 ...,2019-02-12T12:54:53Z
L6E5XYuILhM,逆境力の高い人の10の特徴〜人生の障害を乗り越える最強の力の身につけ方,この動画内で紹介したおすすめ動画・ニコニコ動画は 知識のNetflix【Dラボ】で見放題！ 今なら20日間無料→https://daigovideolab.jp/ リサーチ協力:年5000論文を読む ...,2019-02-17T13:17:13Z
n0t48-opmbc,１０の行動であなたを外向的に変える「性格改造の科学」,この動画内で紹介したおすすめ動画・ニコニコ動画は 知識のNetflix【Dラボ】で見放題！ 今なら20日間無料→https://daigovideolab.jp/ メンタリストDaiGoの無料メンタル ...,2019-02-08T13:28:09Z
-TvyRVHD7pU,トップ2.5%の金持ち達の4つの共通点,この動画内で紹介したおすすめ動画・ニコニコ動画は 知識のNetflix【Dラボ】で見放題！ 今なら20日間無料→https://daigovideolab.jp/ リサーチ協力:年5000論文を読む ...,2019-02-27T12:58:46Z
5D5bTvzzIuk,中断プレイが相手の気を引くワケ,この動画内で紹介したおすすめ動画・ニコニコ動画は 知識のNetflix【Dラボ】で見放題！ 今なら20日間無料→https://daigovideolab.jp/ マッチングアプリ ” with ...,2019-02-11T23:00:02Z
yIHd246cgzk,失恋しても立ち直れる4つの治療法,この動画内で紹介したおすすめ動画・ニコニコ動画は 知識のNetflix【Dラボ】で見放題！ 今なら20日間無料→https://daigovideolab.jp/ マッチングアプリ ” with ...,2019-02-26T23:30:02Z
